<?xml encoding="US-ASCII"?>

<!-- Revision: 24 1.2 docs/data/personal.dtd, xml4jdocs, xml4j-jtcsv, xml4j_1_1_1  -->

<!ELEMENT personnel (person)+>
<!ELEMENT person (name,email*,url*,link?)>
<!ATTLIST person id ID #REQUIRED>
<!ELEMENT family (#PCDATA)>
<!ELEMENT given (#PCDATA)>
<!ELEMENT name (#PCDATA|family|given)*>
<!ELEMENT email (#PCDATA)>
<!ELEMENT url EMPTY>
<!ATTLIST url href CDATA #REQUIRED>
<!ELEMENT link EMPTY>
<!ATTLIST link
  manager IDREF #IMPLIED
  subordinates IDREFS #IMPLIED>
